id,created_utc,subreddit,author,body,score,ups,permalink,body_clean,body_clean_lower,comment_word_count
kpbkeal,1707308329.0,festivals,bradbrookequincy,Over the counter sleep med like Unisom. Test it at home. I only need 1/4 to 1/2 pill. I get 6 hours deep sleep at festivals often very near renegade stages in the camping area.  I usually party to 3-4am so I’m getting 2 hours of the loud soundcamps that go to 5-6am.,1.0,1.0,/r/festivals/comments/1akbv4o/noise_reduction_at_night/kpbkeal/,Over the counter sleep med like Unisom. Test it at home. I only need 1/4 to 1/2 pill. I get 6 hours deep sleep at festivals often very near renegade stages in the camping area.  I usually party to 3-4am so I’m getting 2 hours of the loud soundcamps that go to 5-6am.,over the counter sleep med like unisom. test it at home. i only need 1/4 to 1/2 pill. i get 6 hours deep sleep at festivals often very near renegade stages in the camping area.  i usually party to 3-4am so i’m getting 2 hours of the loud soundcamps that go to 5-6am.,53
kk55dmr,1706554293.0,aves,aaron-mcd,"Yeah it's a thing. I'm not in any city rave scene, but as a nomad/vanlifer I know a few DJs, some friends have big battery/genny/speaker/light setups, and will get together out in the desert for a holiday or something. I got nothing to contribute except having the right friends and bringing some extra firewood lol.

There's one huge non-event every year for a couple weeks out on public land west AZ, a thousand or so nomads gather. Many come for the vehicle inspiration and community and daytime activities, but for many it was literally ""eat sleep rave repeat"" for as many days as one can handle lol. I think we skipped 2 nights out of the 8 we were there. Turned it up on the weekends. There were at least like 5 different soundcamps going at different times, or even the same time.",1.0,1.0,/r/aves/comments/1adgr3p/are_noncommercial_raves_dead_or_its_just_too_hard/kk55dmr/,"Yeah it's a thing. I'm not in any city rave scene, but as a nomad/vanlifer I know a few DJs, some friends have big battery/genny/speaker/light setups, and will get together out in the desert for a holiday or something. I got nothing to contribute except having the right friends and bringing some extra firewood lol. There's one huge non-event every year for a couple weeks out on public land west AZ, a thousand or so nomads gather. Many come for the vehicle inspiration and community and daytime activities, but for many it was literally ""eat sleep rave repeat"" for as many days as one can handle lol. I think we skipped 2 nights out of the 8 we were there. Turned it up on the weekends. There were at least like 5 different soundcamps going at different times, or even the same time.","yeah it's a thing. i'm not in any city rave scene, but as a nomad/vanlifer i know a few djs, some friends have big battery/genny/speaker/light setups, and will get together out in the desert for a holiday or something. i got nothing to contribute except having the right friends and bringing some extra firewood lol. there's one huge non-event every year for a couple weeks out on public land west az, a thousand or so nomads gather. many come for the vehicle inspiration and community and daytime activities, but for many it was literally ""eat sleep rave repeat"" for as many days as one can handle lol. i think we skipped 2 nights out of the 8 we were there. turned it up on the weekends. there were at least like 5 different soundcamps going at different times, or even the same time.",143
kiidirn,1705620342.0,aves,heydelinquent,"As soon as they said rain I knew it was Elements- half the fun of elements are the renegades, soundcamps, &amp; wandering around til sunrise dancing!",1.0,1.0,/r/aves/comments/19a0lf6/how_would_you_react_to_this_situation_at_a/kiidirn/,"As soon as they said rain I knew it was Elements- half the fun of elements are the renegades, soundcamps, & wandering around til sunrise dancing!","as soon as they said rain i knew it was elements- half the fun of elements are the renegades, soundcamps, & wandering around til sunrise dancing!",26
kie7lua,1705553738.0,LostLandsMusicFest,TheGuava1,"I love how every year in the comments of this post on insta or Twitter without fail there are two types of questions 

“Why isn’t so and so’s set from the late night soundcamps on the stream?”

-because they never post/record those. Ever. Same thing with any of the sets from forest or subsidia in the day. I’m sure this is intentional. Can’t just be out here streaming the whole festival for free, would de-incentivize tickets for a chunk of people. I’m just satisfied with how good they are at posting sets compared to every festival 

And then of course there’s the people confused “how they’re streaming a festival in the winter in Ohio”or “how an artist is playing on the stream when they’re supposed to be playing somewhere else on the weekend”

-my brothers and sisters in bass, it is a fucking replay",1.0,1.0,/r/LostLandsMusicFest/comments/199epg0/set_times_for_this_weekend/kie7lua/,"I love how every year in the comments of this post on insta or Twitter without fail there are two types of questions  “Why isn’t so and so’s set from the late night soundcamps on the stream?” because they never post/record those. Ever. Same thing with any of the sets from forest or subsidia in the day. I’m sure this is intentional. Can’t just be out here streaming the whole festival for free, would de-incentivize tickets for a chunk of people. I’m just satisfied with how good they are at posting sets compared to every festival  And then of course there’s the people confused “how they’re streaming a festival in the winter in Ohio”or “how an artist is playing on the stream when they’re supposed to be playing somewhere else on the weekend” my brothers and sisters in bass, it is a fucking replay","i love how every year in the comments of this post on insta or twitter without fail there are two types of questions  “why isn’t so and so’s set from the late night soundcamps on the stream?” because they never post/record those. ever. same thing with any of the sets from forest or subsidia in the day. i’m sure this is intentional. can’t just be out here streaming the whole festival for free, would de-incentivize tickets for a chunk of people. i’m just satisfied with how good they are at posting sets compared to every festival  and then of course there’s the people confused “how they’re streaming a festival in the winter in ohio”or “how an artist is playing on the stream when they’re supposed to be playing somewhere else on the weekend” my brothers and sisters in bass, it is a fucking replay",144
kal044a,1700844603.0,LostLandsMusicFest,jsweeze,The dnb soundcamps were grimey and loud asf surprisingly too,2.0,2.0,/r/LostLandsMusicFest/comments/182u388/how_much_dnb_gets_played/kal044a/,The dnb soundcamps were grimey and loud asf surprisingly too,the dnb soundcamps were grimey and loud asf surprisingly too,10
kakvup6,1700842836.0,LostLandsMusicFest,Apprehensive-Egg329,"Fr lol, i don’t think I’ve been rattled by any speakers as hard as day 3 soundcamps at raptor haha",1.0,1.0,/r/LostLandsMusicFest/comments/182u388/how_much_dnb_gets_played/kakvup6/,"Fr lol, i don’t think I’ve been rattled by any speakers as hard as day 3 soundcamps at raptor haha","fr lol, i don’t think i’ve been rattled by any speakers as hard as day 3 soundcamps at raptor haha",20
kadmym4,1700701317.0,LostLandsMusicFest,ShortyMcFuckstick,Soundcamps have hardstyle the last 2 years. It's not the uk rampage level of hardstyle. But none the less did you see the absolute clusterfuck lil texas caused last year. You could barley get to the forest stage with how many people were at the artifact.,1.0,1.0,/r/LostLandsMusicFest/comments/180anrg/how_would_the_community_feel_about_a_qdance/kadmym4/,Soundcamps have hardstyle the last 2 years. It's not the uk rampage level of hardstyle. But none the less did you see the absolute clusterfuck lil texas caused last year. You could barley get to the forest stage with how many people were at the artifact.,soundcamps have hardstyle the last 2 years. it's not the uk rampage level of hardstyle. but none the less did you see the absolute clusterfuck lil texas caused last year. you could barley get to the forest stage with how many people were at the artifact.,46
k9fu1bw,1700097024.0,aves,bradbrookequincy,It’s an amazing fest. You get like 5% of people who can’t handle anything. I saw people complaining about 10 min walk from Camping and wanted “shuttles.”  Other complaining about rocks and roots in you know the forest.  The line up was sick. Soundcamps amazing. Overall a pretty PLUR crowd .. people make that type of Event what they want. It is as fun and creative as you create. Reminds me I need to get working on my totem,1.0,1.0,/r/aves/comments/17vuy08/whats_the_most_dangerous_thing_youve_seen_at_a/k9fu1bw/,It’s an amazing fest. You get like 5% of people who can’t handle anything. I saw people complaining about 10 min walk from Camping and wanted “shuttles.”  Other complaining about rocks and roots in you know the forest.  The line up was sick. Soundcamps amazing. Overall a pretty PLUR crowd .. people make that type of Event what they want. It is as fun and creative as you create. Reminds me I need to get working on my totem,it’s an amazing fest. you get like 5% of people who can’t handle anything. i saw people complaining about 10 min walk from camping and wanted “shuttles.”  other complaining about rocks and roots in you know the forest.  the line up was sick. soundcamps amazing. overall a pretty plur crowd .. people make that type of event what they want. it is as fun and creative as you create. reminds me i need to get working on my totem,79
k949y5p,1699908567.0,festivals,bradbrookequincy,"Also Elements is just easy from DC. 3.5 hr drive, line up like Electric Forest.    Soundcamps till 5am with many different genres. 5 stages divided loosely by genre. “Arts festival/ Creative Vibe” ..   we all have kids so probably about the same speed.. maybe 1 event locally per month and 2 festivals  Bpm in Costa Rica in January and Elements in August 

Tips for festivals. Bring an easy up or shade tarp for over your tent, multiple battery fans, your own shower from solar to warming water, camp cassette toilet (we have the 5 gallon Thetford and chemicals)    

We have a big group set up and do nice dinners daily. Swing by…    We are 25-65 age camp most 45-55ish 

This Friday LP Giobbi at Soundcheck. If you are only going to EChostage you are missing some good vibes.  

Lp https://www.instagram.com/p/Cw25bjDOCxf/?igshid=MzRlODBiNWFlZA==",1.0,1.0,/r/festivals/comments/17uha9c/whats_a_good_starter_festival/k949y5p/,"Also Elements is just easy from DC. 3.5 hr drive, line up like Electric Forest.    Soundcamps till 5am with many different genres. 5 stages divided loosely by genre. “Arts festival/ Creative Vibe” ..   we all have kids so probably about the same speed.. maybe 1 event locally per month and 2 festivals  Bpm in Costa Rica in January and Elements in August  Tips for festivals. Bring an easy up or shade tarp for over your tent, multiple battery fans, your own shower from solar to warming water, camp cassette toilet (we have the 5 gallon Thetford and chemicals)     We have a big group set up and do nice dinners daily. Swing by…    We are 25-65 age camp most 45-55ish  This Friday LP Giobbi at Soundcheck. If you are only going to EChostage you are missing some good vibes.   Lp ","also elements is just easy from dc. 3.5 hr drive, line up like electric forest.    soundcamps till 5am with many different genres. 5 stages divided loosely by genre. “arts festival/ creative vibe” ..   we all have kids so probably about the same speed.. maybe 1 event locally per month and 2 festivals  bpm in costa rica in january and elements in august  tips for festivals. bring an easy up or shade tarp for over your tent, multiple battery fans, your own shower from solar to warming water, camp cassette toilet (we have the 5 gallon thetford and chemicals)     we have a big group set up and do nice dinners daily. swing by…    we are 25-65 age camp most 45-55ish  this friday lp giobbi at soundcheck. if you are only going to echostage you are missing some good vibes.   lp ",139
k7pcyq1,1699045395.0,festivals,bradbrookequincy,"So did you know the people arrested?  We narcanned a guy who OD’d at Air Stage. We know several OD’d and that one of them told the police where they bought it at which campsite and specific person/ tent (they were not trying to buy fent and bought other things) and that was how the police got a search warrant. Btw I’m not saying you or anyone you know was involved in this. It sounds like it was just a shock these arrests happened near / in your camp? There were arrests were no OD or fent was involved also. That place will be crawling with under covers next year. Locals are complaining about the Soundcamps also. Owners of the racetrack are very religious hope it doesn’t all get f’ck. would not be same fest without sound camps 

I’m just trying to piece some things together.  Oddly the year before someone OD’d on coke in a campsite and he pointed out the seller who was also arrested.",1.0,1.0,/r/festivals/comments/17mwtrk/what_was_the_craziestmost_insanewildest_thing_you/k7pcyq1/,So did you know the people arrested?  We narcanned a guy who OD’d at Air Stage. We know several OD’d and that one of them told the police where they bought it at which campsite and specific person/ tent (they were not trying to buy fent and bought other things) and that was how the police got a search warrant. Btw I’m not saying you or anyone you know was involved in this. It sounds like it was just a shock these arrests happened near / in your camp? There were arrests were no OD or fent was involved also. That place will be crawling with under covers next year. Locals are complaining about the Soundcamps also. Owners of the racetrack are very religious hope it doesn’t all get f’ck. would not be same fest without sound camps  I’m just trying to piece some things together.  Oddly the year before someone OD’d on coke in a campsite and he pointed out the seller who was also arrested.,so did you know the people arrested?  we narcanned a guy who od’d at air stage. we know several od’d and that one of them told the police where they bought it at which campsite and specific person/ tent (they were not trying to buy fent and bought other things) and that was how the police got a search warrant. btw i’m not saying you or anyone you know was involved in this. it sounds like it was just a shock these arrests happened near / in your camp? there were arrests were no od or fent was involved also. that place will be crawling with under covers next year. locals are complaining about the soundcamps also. owners of the racetrack are very religious hope it doesn’t all get f’ck. would not be same fest without sound camps  i’m just trying to piece some things together.  oddly the year before someone od’d on coke in a campsite and he pointed out the seller who was also arrested.,167
k7ady8v,1698789408.0,MDMA,bradbrookequincy,"Ket, 1g shrooms. 1/4 to 1/2 tab lsd, tussi, but I keep bumping the ket very small bumps no matter what else. Everyone I know does everything after the molly. We will often take 1/4 tab or 1g shrooms before.    

I can honestly say I don’t know where the molly stopped and the others kick in for a long smooth ride to soundcamps or after parties.  The ket is really what I can use to control the intensity of that ride. What a little more do another small bump sooner. Get a little to fucked up that’s ok, just wait 15-20 and the ket part wanes.  I have about 5-6 levels of ket I experience before k-hole which I never do. Although what I call slow mo I believe is right before k hole. Once I hit slow mo I’m soon to bed.",1.0,1.0,/r/MDMA/comments/17jvxfk/what_do_you_guys_take_if_you_dont_want_to_take/k7ady8v/,"Ket, 1g shrooms. 1/4 to 1/2 tab lsd, tussi, but I keep bumping the ket very small bumps no matter what else. Everyone I know does everything after the molly. We will often take 1/4 tab or 1g shrooms before.     I can honestly say I don’t know where the molly stopped and the others kick in for a long smooth ride to soundcamps or after parties.  The ket is really what I can use to control the intensity of that ride. What a little more do another small bump sooner. Get a little to fucked up that’s ok, just wait 15-20 and the ket part wanes.  I have about 5-6 levels of ket I experience before k-hole which I never do. Although what I call slow mo I believe is right before k hole. Once I hit slow mo I’m soon to bed.","ket, 1g shrooms. 1/4 to 1/2 tab lsd, tussi, but i keep bumping the ket very small bumps no matter what else. everyone i know does everything after the molly. we will often take 1/4 tab or 1g shrooms before.     i can honestly say i don’t know where the molly stopped and the others kick in for a long smooth ride to soundcamps or after parties.  the ket is really what i can use to control the intensity of that ride. what a little more do another small bump sooner. get a little to fucked up that’s ok, just wait 15-20 and the ket part wanes.  i have about 5-6 levels of ket i experience before k-hole which i never do. although what i call slow mo i believe is right before k hole. once i hit slow mo i’m soon to bed.",143
k73ir2n,1698678816.0,aves,pulzeguy,I’ve seen her as recent as 4 months ago &amp; literally left MainStage for soundcamps because of the ‘mixing’ lol,1.0,1.0,/r/aves/comments/17jjvsh/rezz_cant_mix/k73ir2n/,I’ve seen her as recent as 4 months ago & literally left MainStage for soundcamps because of the ‘mixing’ lol,i’ve seen her as recent as 4 months ago & literally left mainstage for soundcamps because of the ‘mixing’ lol,20
k3hn2ww,1696455645.0,LostLandsMusicFest,Yoda70445,"HA! I LOVE THIS! 🥲

So I’m on the USA east coast. Lost Lands 2019 was my first EDM/bass music festival. And lemme tell you what… that opened the door for me to see what’s possible. 80-100K headbangers (lemme say that again) HEADBANGERS who know how to get down and have a good time.

I love Lost Lands and that year will always hold a special place in my heart. I’ve been to LL 19, LL Reunion (during Covid), LL 22, and Shambhala 23 (this year).

Here’s the main differences I can tell you about:
LL:
-merch is a HUGE part of American EDM culture so that makes an impact
-it is commercial so yes Alcohol is overpriced 
-food cost can vary but is generally overpriced for the quality/quantity of food
-they’ve added more and more stages and soundcamps
-more stages allows for more artists. And a bigger budget to book more
-the hardest pill to swallow (not as PLUR as shambs 💔) with MANY new people coming every year without intention of safe raving and desire to lookout for others ( Brads and Chads)
-expensive to book with the price of ticket separate from camping (especially if you don’t have ppl to split the camping cost)
-the security line has always been great and fast(unlike the lifetime of a wait for Shambs as ya know)

Shambhala from my experience:
-20K people or so if I’ve got that right? So the crowd is smaller
- not every person is a headbanger so not really much moshing or neck breaking occurs. ( lack of rails contributes too)
-THE FOOD 😍 so affordable and better IMO
-the stage design IMO is slightly better though X does pour $$ into his production very much so for LL. Just nicer to have only 6 stages to focus on instead of all the extra spaces.
- People aren’t obsessed over getting merch and I LOVE IT. More creative outfits and less gentrification of EDM wear. Plus the wallet can appreciate it too. 
- the river. BLESSED to have it. Legend valley is great but boy it can be rough walking for miles and miles in a weekend without any water to cool off
-general festival size is manageable for most. LL is kinda bigger than ever and absolutely huge.
-the PLUR vibes I got blessed with by my farmily were unmatched. Not that LL doesn’t have any but with the variety of newcomers and others without care for your own existence I have to give it to the farm for this 💪. **Oh yeah I’ve had my phone stolen at Lost Lands, but we won’t get into that**

So that’s my lil comparison. From someone who’s an avid raver and tryna go to all the worlds fests that I can. I hope it helps. DM if I can help answering any questions!!",1.0,1.0,/r/LostLandsMusicFest/comments/16zr044/lost_lands_vs_shambhala/k3hn2ww/,"HA! I LOVE THIS!  So I’m on the USA east coast. Lost Lands 2019 was my first EDM/bass music festival. And lemme tell you what… that opened the door for me to see what’s possible. 80-100K headbangers (lemme say that again) HEADBANGERS who know how to get down and have a good time. I love Lost Lands and that year will always hold a special place in my heart. I’ve been to LL 19, LL Reunion (during Covid), LL 22, and Shambhala 23 (this year). Here’s the main differences I can tell you about LLmerch is a HUGE part of American EDM culture so that makes an impactit is commercial so yes Alcohol is overpriced food cost can vary but is generally overpriced for the quality/quantity of foodthey’ve added more and more stages and soundcampsmore stages allows for more artists. And a bigger budget to book morethe hardest pill to swallow (not as PLUR as shambs ) with MANY new people coming every year without intention of safe raving and desire to lookout for others ( Brads and Chads)expensive to book with the price of ticket separate from camping (especially if you don’t have ppl to split the camping cost)the security line has always been great and fast(unlike the lifetime of a wait for Shambs as ya know) Shambhala from my experience20K people or so if I’ve got that right? So the crowd is smaller not every person is a headbanger so not really much moshing or neck breaking occurs. ( lack of rails contributes too)THE FOOD  so affordable and better IMOthe stage design IMO is slightly better though X does pour $$ into his production very much so for LL. Just nicer to have only 6 stages to focus on instead of all the extra spaces. People aren’t obsessed over getting merch and I LOVE IT. More creative outfits and less gentrification of EDM wear. Plus the wallet can appreciate it too.  the river. BLESSED to have it. Legend valley is great but boy it can be rough walking for miles and miles in a weekend without any water to cool offgeneral festival size is manageable for most. LL is kinda bigger than ever and absolutely huge.the PLUR vibes I got blessed with by my farmily were unmatched. Not that LL doesn’t have any but with the variety of newcomers and others without care for your own existence I have to give it to the farm for this . **Oh yeah I’ve had my phone stolen at Lost Lands, but we won’t get into that** So that’s my lil comparison. From someone who’s an avid raver and tryna go to all the worlds fests that I can. I hope it helps. DM if I can help answering any questions!!","ha! i love this!  so i’m on the usa east coast. lost lands 2019 was my first edm/bass music festival. and lemme tell you what… that opened the door for me to see what’s possible. 80-100k headbangers (lemme say that again) headbangers who know how to get down and have a good time. i love lost lands and that year will always hold a special place in my heart. i’ve been to ll 19, ll reunion (during covid), ll 22, and shambhala 23 (this year). here’s the main differences i can tell you about llmerch is a huge part of american edm culture so that makes an impactit is commercial so yes alcohol is overpriced food cost can vary but is generally overpriced for the quality/quantity of foodthey’ve added more and more stages and soundcampsmore stages allows for more artists. and a bigger budget to book morethe hardest pill to swallow (not as plur as shambs ) with many new people coming every year without intention of safe raving and desire to lookout for others ( brads and chads)expensive to book with the price of ticket separate from camping (especially if you don’t have ppl to split the camping cost)the security line has always been great and fast(unlike the lifetime of a wait for shambs as ya know) shambhala from my experience20k people or so if i’ve got that right? so the crowd is smaller not every person is a headbanger so not really much moshing or neck breaking occurs. ( lack of rails contributes too)the food  so affordable and better imothe stage design imo is slightly better though x does pour $$ into his production very much so for ll. just nicer to have only 6 stages to focus on instead of all the extra spaces. people aren’t obsessed over getting merch and i love it. more creative outfits and less gentrification of edm wear. plus the wallet can appreciate it too.  the river. blessed to have it. legend valley is great but boy it can be rough walking for miles and miles in a weekend without any water to cool offgeneral festival size is manageable for most. ll is kinda bigger than ever and absolutely huge.the plur vibes i got blessed with by my farmily were unmatched. not that ll doesn’t have any but with the variety of newcomers and others without care for your own existence i have to give it to the farm for this . **oh yeah i’ve had my phone stolen at lost lands, but we won’t get into that** so that’s my lil comparison. from someone who’s an avid raver and tryna go to all the worlds fests that i can. i hope it helps. dm if i can help answering any questions!!",460
