id,created_utc,subreddit,author,body,score,ups,permalink,body_clean,body_clean_lower,comment_word_count
f28hemr,1570061668.0,LostLandsMusicFest,imLC,"Can’t get hung up on the past fam. The Soundcamps were also ridiculously dangerous as far as security and water last year. If they were allowed to turn it up, you could bet everything you own they would. 

The guys in charge are following guidelines so that we can come back next year! That deserves applause. I want to come back for years to come.",5.0,,/r/LostLandsMusicFest/comments/dcbzcv/soundcamps/f28hemr/,"Can’t get hung up on the past fam. The Soundcamps were also ridiculously dangerous as far as security and water last year. If they were allowed to turn it up, you could bet everything you own they would.  The guys in charge are following guidelines so that we can come back next year! That deserves applause. I want to come back for years to come.","can’t get hung up on the past fam. the soundcamps were also ridiculously dangerous as far as security and water last year. if they were allowed to turn it up, you could bet everything you own they would.  the guys in charge are following guidelines so that we can come back next year! that deserves applause. i want to come back for years to come.",65
f27vurr,1570047180.0,LostLandsMusicFest,less_than_nick,"I was middle back of the crowd for every set I saw in the soundcamps (raptor alley, takeover stage, wooky woods) and could hear them just fine. Yeah, it was quieter than the mainstages during the day but that wasn't a surprise. Compared to the mess sound camps were last year I think they were really on point this past weekend.

edit: to be honest I was pretty close for hydraulix on sunday night and had to put in my earplugs cause it was too loud for me lol",5.0,,/r/LostLandsMusicFest/comments/dcbzcv/soundcamps/f27vurr/,"I was middle back of the crowd for every set I saw in the soundcamps (raptor alley, takeover stage, wooky woods) and could hear them just fine. Yeah, it was quieter than the mainstages during the day but that wasn't a surprise. Compared to the mess sound camps were last year I think they were really on point this past weekend. edit to be honest I was pretty close for hydraulix on sunday night and had to put in my earplugs cause it was too loud for me lol","i was middle back of the crowd for every set i saw in the soundcamps (raptor alley, takeover stage, wooky woods) and could hear them just fine. yeah, it was quieter than the mainstages during the day but that wasn't a surprise. compared to the mess sound camps were last year i think they were really on point this past weekend. edit to be honest i was pretty close for hydraulix on sunday night and had to put in my earplugs cause it was too loud for me lol",89
f27jyw3,1570039918.0,LostLandsMusicFest,beyond_the_wall,"I actually thought the soundcamps were amazing, however I was surprised that The Pit and the Takeover Stage had the worst sound out of all of them. I think the problem with them was that the subs were too far apart from each other to pack a punch. They were designed to be main stages not side stages.   


Raptor Alley, The Asteroid and Wooky Woods all sounded and looked awesome and after Friday those were the only 3 stages I went to for the camps. Favorite sets were definitely Zeke Beats, um.., and Stuca.",8.0,,/r/LostLandsMusicFest/comments/dcbzcv/soundcamps/f27jyw3/,"I actually thought the soundcamps were amazing, however I was surprised that The Pit and the Takeover Stage had the worst sound out of all of them. I think the problem with them was that the subs were too far apart from each other to pack a punch. They were designed to be main stages not side stages.    Raptor Alley, The Asteroid and Wooky Woods all sounded and looked awesome and after Friday those were the only 3 stages I went to for the camps. Favorite sets were definitely Zeke Beats, um.., and Stuca.","i actually thought the soundcamps were amazing, however i was surprised that the pit and the takeover stage had the worst sound out of all of them. i think the problem with them was that the subs were too far apart from each other to pack a punch. they were designed to be main stages not side stages.    raptor alley, the asteroid and wooky woods all sounded and looked awesome and after friday those were the only 3 stages i went to for the camps. favorite sets were definitely zeke beats, um.., and stuca.",94
f27b2cx,1570034259.0,LostLandsMusicFest,rideitlikeustoleit_,wear earplugs until midnite and take them out after. the soundcamps were loud enough then. sure i wanted it louder too but low volume is better than sitting at my camp listening to a shitty bluetooth speaker,21.0,,/r/LostLandsMusicFest/comments/dcbzcv/soundcamps/f27b2cx/,wear earplugs until midnite and take them out after. the soundcamps were loud enough then. sure i wanted it louder too but low volume is better than sitting at my camp listening to a shitty bluetooth speaker,wear earplugs until midnite and take them out after. the soundcamps were loud enough then. sure i wanted it louder too but low volume is better than sitting at my camp listening to a shitty bluetooth speaker,37
f276r9j,1570031773.0,LostLandsMusicFest,jseams12,"I agree, I was at the soundcamps for Vampa and she was quiet. I was hoping when Dubloadz came on they would turn it up since he was supposed to be a main stage artist, but they still did not. The crowd even started a turn it up! chant",7.0,,/r/LostLandsMusicFest/comments/dcbzcv/soundcamps/f276r9j/,"I agree, I was at the soundcamps for Vampa and she was quiet. I was hoping when Dubloadz came on they would turn it up since he was supposed to be a main stage artist, but they still did not. The crowd even started a turn it up! chant","i agree, i was at the soundcamps for vampa and she was quiet. i was hoping when dubloadz came on they would turn it up since he was supposed to be a main stage artist, but they still did not. the crowd even started a turn it up! chant",49
f24xntt,1569962169.0,LostLandsMusicFest,hunman2019,"There were so so many amazing moments this weekend it’s really hard to pick, but one of my favorites was definitely when Downlink decided to play 30 minutes of straight neuro drum and bass. I had been craving some dnb all weekend, and besides a few artists at the soundcamps it was so rare to find anyone playing dnb. Then Downlink goes and fucking destorys wompy Woods with some of the fattest undergroumd tracks and classic hits. I absolutely lost my shit when he played Tarantula😁 Big shout out to Downlink, thank you so fucking much. Hes completely right, America NEEDS more dnb.",1.0,,/r/LostLandsMusicFest/comments/db87c4/lost_lands_day_3_discussion_thread/f24xntt/,"There were so so many amazing moments this weekend it’s really hard to pick, but one of my favorites was definitely when Downlink decided to play 30 minutes of straight neuro drum and bass. I had been craving some dnb all weekend, and besides a few artists at the soundcamps it was so rare to find anyone playing dnb. Then Downlink goes and fucking destorys wompy Woods with some of the fattest undergroumd tracks and classic hits. I absolutely lost my shit when he played Tarantula Big shout out to Downlink, thank you so fucking much. Hes completely right, America NEEDS more dnb.","there were so so many amazing moments this weekend it’s really hard to pick, but one of my favorites was definitely when downlink decided to play 30 minutes of straight neuro drum and bass. i had been craving some dnb all weekend, and besides a few artists at the soundcamps it was so rare to find anyone playing dnb. then downlink goes and fucking destorys wompy woods with some of the fattest undergroumd tracks and classic hits. i absolutely lost my shit when he played tarantula big shout out to downlink, thank you so fucking much. hes completely right, america needs more dnb.",103
f24boqo,1569948571.0,LostLandsMusicFest,LucheriniHD,"Soundcamps on sunday were unbearably quiet at least at the Takeover Stage. At least 10 times the entire crowd was chanting ""Turn it up"" (sometimes in beat to the riddim which was pretty funny) Idk if it was because it was monday morning they had to be quiet due to sound ordinances, but if that's the case dont have soundcamps at all on sunday night/Monday morning",1.0,,/r/LostLandsMusicFest/comments/db87c4/lost_lands_day_3_discussion_thread/f24boqo/,"Soundcamps on sunday were unbearably quiet at least at the Takeover Stage. At least 10 times the entire crowd was chanting ""Turn it up"" (sometimes in beat to the riddim which was pretty funny) Idk if it was because it was monday morning they had to be quiet due to sound ordinances, but if that's the case dont have soundcamps at all on sunday night/Monday morning","soundcamps on sunday were unbearably quiet at least at the takeover stage. at least 10 times the entire crowd was chanting ""turn it up"" (sometimes in beat to the riddim which was pretty funny) idk if it was because it was monday morning they had to be quiet due to sound ordinances, but if that's the case dont have soundcamps at all on sunday night/monday morning",66
f24b2m4,1569948201.0,EDM,kylewhatever,"I think everything you said was fair. I did GA last year and had a great time, but told myself that I wouldn't come back this year unless I did an upgraded package. I did RV with some friends this year and I had the most incredible weekend. 

I felt that last year the soundcamps were exponentially better, but other than that, my whole crew agreed that the LL team did a fucking great job at listening to our concerns and fixing issues those arose last year. The biggest change they made this year, in my opinion, was security. I am going to get flamed for this, but it was almost TOO relaxed. No metal detectors at venue entrance, you could get whatever you wanted in no problem. Getting into the campground you had a security check, but since I did RV and rode separately, I walked my wagon to my RV from my car without a single check. Yes, these are great things for 99.99% of people, but there are evil people that WILL eventually take advantage of these things one way or another

If you like the lineup next year, I'd recommend doing an upgraded package of some sort. Made a world of difference having AC and being 5 minutes from the venue entrance",3.0,,/r/EDM/comments/dbu8tx/i_wrote_a_review_of_lost_lands_2019_for_raves_let/f24b2m4/,"I think everything you said was fair. I did GA last year and had a great time, but told myself that I wouldn't come back this year unless I did an upgraded package. I did RV with some friends this year and I had the most incredible weekend.  I felt that last year the soundcamps were exponentially better, but other than that, my whole crew agreed that the LL team did a fucking great job at listening to our concerns and fixing issues those arose last year. The biggest change they made this year, in my opinion, was security. I am going to get flamed for this, but it was almost TOO relaxed. No metal detectors at venue entrance, you could get whatever you wanted in no problem. Getting into the campground you had a security check, but since I did RV and rode separately, I walked my wagon to my RV from my car without a single check. Yes, these are great things for 99.99% of people, but there are evil people that WILL eventually take advantage of these things one way or another If you like the lineup next year, I'd recommend doing an upgraded package of some sort. Made a world of difference having AC and being 5 minutes from the venue entrance","i think everything you said was fair. i did ga last year and had a great time, but told myself that i wouldn't come back this year unless i did an upgraded package. i did rv with some friends this year and i had the most incredible weekend.  i felt that last year the soundcamps were exponentially better, but other than that, my whole crew agreed that the ll team did a fucking great job at listening to our concerns and fixing issues those arose last year. the biggest change they made this year, in my opinion, was security. i am going to get flamed for this, but it was almost too relaxed. no metal detectors at venue entrance, you could get whatever you wanted in no problem. getting into the campground you had a security check, but since i did rv and rode separately, i walked my wagon to my rv from my car without a single check. yes, these are great things for 99.99% of people, but there are evil people that will eventually take advantage of these things one way or another if you like the lineup next year, i'd recommend doing an upgraded package of some sort. made a world of difference having ac and being 5 minutes from the venue entrance",216
f23phr9,1569933987.0,LostLandsMusicFest,thearkhitekt,"I believe the campgrounds are too close to residential to have sound as loud as they did in the fest grounds. Increasing sound at any of the soundcamps would have caused more sound bleeding. Overall, I think this year was 10000x improvement from last. Yes it was a hike, and I didn't make it back each night, but that's okay.",8.0,,/r/LostLandsMusicFest/comments/dbo32f/what_do_you_guys_think_of_the_sound_camps_being/f23phr9/,"I believe the campgrounds are too close to residential to have sound as loud as they did in the fest grounds. Increasing sound at any of the soundcamps would have caused more sound bleeding. Overall, I think this year was 10000x improvement from last. Yes it was a hike, and I didn't make it back each night, but that's okay.","i believe the campgrounds are too close to residential to have sound as loud as they did in the fest grounds. increasing sound at any of the soundcamps would have caused more sound bleeding. overall, i think this year was 10000x improvement from last. yes it was a hike, and i didn't make it back each night, but that's okay.",60
f20tbnk,1569863808.0,riddim,LucheriniHD,"I was there, shit was fat, that crowd was so fucking rowdy and just craved riddim. If the volume was actually at a decent level that whole night of soundcamps wouldve been a madhouse",15.0,,/r/riddim/comments/dbd6ng/who_caught_aweminus_last_night_of_lost_lands_my/f20tbnk/,"I was there, shit was fat, that crowd was so fucking rowdy and just craved riddim. If the volume was actually at a decent level that whole night of soundcamps wouldve been a madhouse","i was there, shit was fat, that crowd was so fucking rowdy and just craved riddim. if the volume was actually at a decent level that whole night of soundcamps wouldve been a madhouse",34
f1onfq1,1569653031.0,LostLandsMusicFest,PumpersLikeToPump,"I was planning on doing soundcamps through to the end tonight but only made it through Chime, I am beat the hell up after that X set but goddamn it was worth it, the man put on a fire show tonight.",10.0,,/r/LostLandsMusicFest/comments/dabxu4/okay_but_first_of_all/f1onfq1/,"I was planning on doing soundcamps through to the end tonight but only made it through Chime, I am beat the hell up after that X set but goddamn it was worth it, the man put on a fire show tonight.","i was planning on doing soundcamps through to the end tonight but only made it through chime, i am beat the hell up after that x set but goddamn it was worth it, the man put on a fire show tonight.",41
f1ahdh1,1569294041.0,Wakaan,710jaybird,"They have stages goin till 7am, probably no soundcamps, wakaan asked nicely haha",12.0,,/r/Wakaan/comments/d8gmqm/any_soundcamps_going_down/f1ahdh1/,"They have stages goin till 7am, probably no soundcamps, wakaan asked nicely haha","they have stages goin till 7am, probably no soundcamps, wakaan asked nicely haha",13
f0x2hqp,1569019798.0,aves,GREATNATEHATE,"LOL These guys play the main stages, and then go over to the soundcamps after. Mainstages close at midnight and they show Jurassic park on the giant video walls with animatronic dinosaurs all over the place. Y'all need to relax, this party is dope.",5.0,,/r/aves/comments/d71932/imagine_booking_some_of_the_most_pivotal_dnb_acts/f0x2hqp/,"LOL These guys play the main stages, and then go over to the soundcamps after. Mainstages close at midnight and they show Jurassic park on the giant video walls with animatronic dinosaurs all over the place. Y'all need to relax, this party is dope.","lol these guys play the main stages, and then go over to the soundcamps after. mainstages close at midnight and they show jurassic park on the giant video walls with animatronic dinosaurs all over the place. y'all need to relax, this party is dope.",44
f0vxwgl,1568994427.0,LostLandsMusicFest,justinmn9319,"they were the one i was hoping wasn't soundcamps lol. this is a pass or fail test, % don't matter",7.0,,/r/LostLandsMusicFest/comments/d6w70t/you_were_all_wrong/f0vxwgl/,"they were the one i was hoping wasn't soundcamps lol. this is a pass or fail test, % don't matter","they were the one i was hoping wasn't soundcamps lol. this is a pass or fail test, % don't matter",20
f0ow5sy,1568821630.0,LostLandsMusicFest,Iskom,You can find this on the daily lineups that were released recently. These daily lineups include the soundcamps. I am assuming some of those soundcamps still have not been released. This leaves even more artists on the daily lineup that will end up playing a different soundcamp that is not announced yet.,2.0,,/r/LostLandsMusicFest/comments/d5zibo/daily_soundcamp_lineup_updated/f0ow5sy/,You can find this on the daily lineups that were released recently. These daily lineups include the soundcamps. I am assuming some of those soundcamps still have not been released. This leaves even more artists on the daily lineup that will end up playing a different soundcamp that is not announced yet.,you can find this on the daily lineups that were released recently. these daily lineups include the soundcamps. i am assuming some of those soundcamps still have not been released. this leaves even more artists on the daily lineup that will end up playing a different soundcamp that is not announced yet.,52
f0nfvzp,1568769005.0,LostLandsMusicFest,Malcom_Ecstacy,This is one of the sound camps. It's not all of the soundcamps this is just whose playing on this stage.,7.0,,/r/LostLandsMusicFest/comments/d5nths/sound_camp_announcement/f0nfvzp/,This is one of the sound camps. It's not all of the soundcamps this is just whose playing on this stage.,this is one of the sound camps. it's not all of the soundcamps this is just whose playing on this stage.,21
f0miuj1,1568745975.0,LostLandsMusicFest,P3rs3us1,"That’s what I was thinking. This is clearly enough for a whole weekend’s worth of sets if you figure they start at 12-12:30ish, but it’s missing a lot of people I’d assume were soundcamps. Here’s hoping for another announcement today!",1.0,,/r/LostLandsMusicFest/comments/d596s4/the_astroid_sound_camp_announcement/f0miuj1/,"That’s what I was thinking. This is clearly enough for a whole weekend’s worth of sets if you figure they start at 12-1230ish, but it’s missing a lot of people I’d assume were soundcamps. Here’s hoping for another announcement today!","that’s what i was thinking. this is clearly enough for a whole weekend’s worth of sets if you figure they start at 12-1230ish, but it’s missing a lot of people i’d assume were soundcamps. here’s hoping for another announcement today!",40
f080ea3,1568472639.0,BurningMan,doctor-yes,"Three points: 

1. Yes it’s undoubtedly undergoing a cultural shift, though that’s been happening since the 90s. Unfortunately for the culture and event, the shift happening today is leading to some pretty indisputably bad things like more garbage by the roads. From my perspective the shift is mostly a result of the mainstreaming of the event in popular culture. It’s become a checklist item for the music festival crowd, quite unfortunately.

2. If nighttime feels like EDC to you it’s entirely because of how and where you spend your time on the playa. It feels nothing like EDC to me because I don’t really go to soundcamps any more (and I stay well away from Mayan Warrior etc) except to briefly marvel at how their scale increases every year. I spend my time at smaller camps in the city where you get more community than people trying to be part of a scene. One way isn’t better than another or anything, but if you spend your time at EDC-type places out there, that’s the experience you’re going to have.

3. The principles themselves and especially the emphasis people often put on them these days are a cultural shift. The event wasn’t founded on them and it thrived for longer (18 years) without them than it has with them (16 years).",14.0,,/r/BurningMan/comments/d40tlu/is_bm_going_through_a_cultural_shift/f080ea3/,"Three points  1. Yes it’s undoubtedly undergoing a cultural shift, though that’s been happening since the 90s. Unfortunately for the culture and event, the shift happening today is leading to some pretty indisputably bad things like more garbage by the roads. From my perspective the shift is mostly a result of the mainstreaming of the event in popular culture. It’s become a checklist item for the music festival crowd, quite unfortunately. 2. If nighttime feels like EDC to you it’s entirely because of how and where you spend your time on the playa. It feels nothing like EDC to me because I don’t really go to soundcamps any more (and I stay well away from Mayan Warrior etc) except to briefly marvel at how their scale increases every year. I spend my time at smaller camps in the city where you get more community than people trying to be part of a scene. One way isn’t better than another or anything, but if you spend your time at EDC-type places out there, that’s the experience you’re going to have. 3. The principles themselves and especially the emphasis people often put on them these days are a cultural shift. The event wasn’t founded on them and it thrived for longer (18 years) without them than it has with them (16 years).","three points  1. yes it’s undoubtedly undergoing a cultural shift, though that’s been happening since the 90s. unfortunately for the culture and event, the shift happening today is leading to some pretty indisputably bad things like more garbage by the roads. from my perspective the shift is mostly a result of the mainstreaming of the event in popular culture. it’s become a checklist item for the music festival crowd, quite unfortunately. 2. if nighttime feels like edc to you it’s entirely because of how and where you spend your time on the playa. it feels nothing like edc to me because i don’t really go to soundcamps any more (and i stay well away from mayan warrior etc) except to briefly marvel at how their scale increases every year. i spend my time at smaller camps in the city where you get more community than people trying to be part of a scene. one way isn’t better than another or anything, but if you spend your time at edc-type places out there, that’s the experience you’re going to have. 3. the principles themselves and especially the emphasis people often put on them these days are a cultural shift. the event wasn’t founded on them and it thrived for longer (18 years) without them than it has with them (16 years).",220
ezku4cj,1567966584.0,LostLandsMusicFest,madijanee,"Based off of all the Wakaan artists that will be there like Liquid Stranger, Lsdream, Lucii, Hydraulix, G-Rex, Peekaboo, Tynan, Champagne Drip, Schlump, Space Jesus (hopefully I got them all) I hope they all do a massive b2b because since its at a soundcamps so maybe they will have a longer time slot! Fingers crossed 🤞 low key hope INZO shows up too but I think that may be asking too much :p",3.0,,/r/LostLandsMusicFest/comments/d12q0p/hey_reddit_fam_come_say_hi_if_you_see_our_totem/ezku4cj/,"Based off of all the Wakaan artists that will be there like Liquid Stranger, Lsdream, Lucii, Hydraulix, G-Rex, Peekaboo, Tynan, Champagne Drip, Schlump, Space Jesus (hopefully I got them all) I hope they all do a massive b2b because since its at a soundcamps so maybe they will have a longer time slot! Fingers crossed  low key hope INZO shows up too but I think that may be asking too much p","based off of all the wakaan artists that will be there like liquid stranger, lsdream, lucii, hydraulix, g-rex, peekaboo, tynan, champagne drip, schlump, space jesus (hopefully i got them all) i hope they all do a massive b2b because since its at a soundcamps so maybe they will have a longer time slot! fingers crossed  low key hope inzo shows up too but i think that may be asking too much p",72
eza0it4,1567792857.0,LostLandsMusicFest,TrollBearPig-what,Any tips for surviving until 4-5am on these soundcamps? So many I want to see but I'm actually worried I'll be too freaking exausted to make it that far.,3.0,,/r/LostLandsMusicFest/comments/d0jxa0/which_undercard_djs_are_you_excited_for/eza0it4/,Any tips for surviving until 4-5am on these soundcamps? So many I want to see but I'm actually worried I'll be too freaking exausted to make it that far.,any tips for surviving until 4-5am on these soundcamps? so many i want to see but i'm actually worried i'll be too freaking exausted to make it that far.,29
ez8rwrt,1567756133.0,LostLandsMusicFest,kimdakuntbag,Does anyone know what times the festival ends and  soundcamps start? I’m coming late Friday and scared I’m gonna miss all my bigger names,1.0,,/r/LostLandsMusicFest/comments/czr4ia/daily_lineup_announced/ez8rwrt/,Does anyone know what times the festival ends and  soundcamps start? I’m coming late Friday and scared I’m gonna miss all my bigger names,does anyone know what times the festival ends and  soundcamps start? i’m coming late friday and scared i’m gonna miss all my bigger names,24
