id,created_utc,subreddit,author,body,score,ups,permalink,body_clean,body_clean_lower,comment_word_count
dos53ap,1508784404.0,electricdaisycarnival,edcRachel,"For the solar shower - we usually just run ours off the hood of the car.

Eh, we have been camped DIRECTLY beside soundcamps at festivals. If you're tired enough, you'll pass out. And if you need more sleep, it's not such a big deal to miss the first hour or whatever. It's not like you'll be missing your ride.... and you're forgetting the commuting time in that sleep time calculation. If it takes you 3 hours to get ready for either, what about the hour+ commute each way? You can use that time to sleep. 

I guess it's alright if you already have an RV. I don't, I'd be renting it, which is just way too much hassle for me. Tent camping fo lyfe. ",4.0,,/r/electricdaisycarnival/comments/788qwn/who_is_planning_to_do_the_camping_at_edc/dos53ap/,"For the solar shower - we usually just run ours off the hood of the car. Eh, we have been camped DIRECTLY beside soundcamps at festivals. If you're tired enough, you'll pass out. And if you need more sleep, it's not such a big deal to miss the first hour or whatever. It's not like you'll be missing your ride.... and you're forgetting the commuting time in that sleep time calculation. If it takes you 3 hours to get ready for either, what about the hour commute each way? You can use that time to sleep.  I guess it's alright if you already have an RV. I don't, I'd be renting it, which is just way too much hassle for me. Tent camping fo lyfe. ","for the solar shower - we usually just run ours off the hood of the car. eh, we have been camped directly beside soundcamps at festivals. if you're tired enough, you'll pass out. and if you need more sleep, it's not such a big deal to miss the first hour or whatever. it's not like you'll be missing your ride.... and you're forgetting the commuting time in that sleep time calculation. if it takes you 3 hours to get ready for either, what about the hour commute each way? you can use that time to sleep.  i guess it's alright if you already have an rv. i don't, i'd be renting it, which is just way too much hassle for me. tent camping fo lyfe. ",125
dnlpaq4,1506553480.0,electricdaisycarnival,Disco_Bush,"Hi Pasquale! 

I'm so happy to see the festival evolving into a more immersive experience. Can you tell us more about what kind of soundcamps, workshops and activities will be in the camping village? If this is still in development, are you accepting proposals for participation in the village? I'd love the opportunity to host an acoustic camp, with a dash of karaoke :) ",2.0,,,"Hi Pasquale!  I'm so happy to see the festival evolving into a more immersive experience. Can you tell us more about what kind of soundcamps, workshops and activities will be in the camping village? If this is still in development, are you accepting proposals for participation in the village? I'd love the opportunity to host an acoustic camp, with a dash of karaoke ) ","hi pasquale!  i'm so happy to see the festival evolving into a more immersive experience. can you tell us more about what kind of soundcamps, workshops and activities will be in the camping village? if this is still in development, are you accepting proposals for participation in the village? i'd love the opportunity to host an acoustic camp, with a dash of karaoke ) ",64
dnli4bc,1506545156.0,electricdaisycarnival,The-Rez,"They had soundcamps at Middle Lands this year, and fuck they were amazing. Music non stop, and quite a few people partying till the sun came up. It’s basically a little stage in the campgrounds run by campers. ",1.0,,,"They had soundcamps at Middle Lands this year, and fuck they were amazing. Music non stop, and quite a few people partying till the sun came up. It’s basically a little stage in the campgrounds run by campers. ","they had soundcamps at middle lands this year, and fuck they were amazing. music non stop, and quite a few people partying till the sun came up. it’s basically a little stage in the campgrounds run by campers. ",38
dn7wo8l,1505837545.0,BurningMan,Tel1234,"I would guess that's partly because some of the major soundcamps didn't release their line up, and partly that rockstarlibrarian was much less user friendly this year.

In previous years, people would have generally been able to use one of these two resources to find the info themselves.",7.0,,,"I would guess that's partly because some of the major soundcamps didn't release their line up, and partly that rockstarlibrarian was much less user friendly this year. In previous years, people would have generally been able to use one of these two resources to find the info themselves.","i would guess that's partly because some of the major soundcamps didn't release their line up, and partly that rockstarlibrarian was much less user friendly this year. in previous years, people would have generally been able to use one of these two resources to find the info themselves.",48
dn4l9hn,1505662113.0,BurningMan,sovamind,"I suspect that the camp on esplanade with the pink hearts stole my virginity. I know it was them, but I can't remember their camp name. I last saw my virginity when I was at their camp right before I took several hits of ecstasy from a stranger. I then got so fucked up that I set my virginity down and walked away from it. When I woke up the next day I couldn't find it! I went back to the camp and it wasn't there and they told me to check lost and found. Guess what!? I have contacted them 7 times now and they just can't find it. I'm really mad and can't believe that someone would do this to me and make me have these feelings! What's wrong with this event!? Things are being ruined by all these new comers and soundcamps!!",15.0,,,"I suspect that the camp on esplanade with the pink hearts stole my virginity. I know it was them, but I can't remember their camp name. I last saw my virginity when I was at their camp right before I took several hits of ecstasy from a stranger. I then got so fucked up that I set my virginity down and walked away from it. When I woke up the next day I couldn't find it! I went back to the camp and it wasn't there and they told me to check lost and found. Guess what!? I have contacted them 7 times now and they just can't find it. I'm really mad and can't believe that someone would do this to me and make me have these feelings! What's wrong with this event!? Things are being ruined by all these new comers and soundcamps!!","i suspect that the camp on esplanade with the pink hearts stole my virginity. i know it was them, but i can't remember their camp name. i last saw my virginity when i was at their camp right before i took several hits of ecstasy from a stranger. i then got so fucked up that i set my virginity down and walked away from it. when i woke up the next day i couldn't find it! i went back to the camp and it wasn't there and they told me to check lost and found. guess what!? i have contacted them 7 times now and they just can't find it. i'm really mad and can't believe that someone would do this to me and make me have these feelings! what's wrong with this event!? things are being ruined by all these new comers and soundcamps!!",145
dn3mvhi,1505599519.0,BurningMan,wildempty,"Sorry your bag got stolen but you come across as an entitled douche. You left your bag filled with expensive dj gear, someone (anyone) picked it up, and now you're trying to blame the sound camp and ""get them kicked off the playa"" instead of taking responsibility for your own dumb mistake. Seriously, get a clue. Anyone could have taken your bag bro. Lesson learned. Quit trying to blame innocent soundcamps.

What evidence do you have that this camp or its members specifically took your bag? And not some random person .....",33.0,,,"Sorry your bag got stolen but you come across as an entitled douche. You left your bag filled with expensive dj gear, someone (anyone) picked it up, and now you're trying to blame the sound camp and ""get them kicked off the playa"" instead of taking responsibility for your own dumb mistake. Seriously, get a clue. Anyone could have taken your bag bro. Lesson learned. Quit trying to blame innocent soundcamps. What evidence do you have that this camp or its members specifically took your bag? And not some random person .....","sorry your bag got stolen but you come across as an entitled douche. you left your bag filled with expensive dj gear, someone (anyone) picked it up, and now you're trying to blame the sound camp and ""get them kicked off the playa"" instead of taking responsibility for your own dumb mistake. seriously, get a clue. anyone could have taken your bag bro. lesson learned. quit trying to blame innocent soundcamps. what evidence do you have that this camp or its members specifically took your bag? and not some random person .....",92
dmr1t6m,1504910449.0,bestof,twoinvenice,"I thought so too, and then there they were, a pair of psuedo-soundcamps back in the neighborhood blasting music to no one. Last year we were in the same area and around 2 or 3am it would be quiet...it was real nice.

Someone in the burning man sub also mentioned that they felt like there is currently a glut of these silly pretend sound camps that don't actually do anything cool - I guess it is easy to set up a stage and speakers and say you are providing a service. Apparently that big pyramid sound camp on Esplanade that looked like a convention center ended up actually kinda sucking after spending a ton of money and time building a massive structure. ",1.0,,,"I thought so too, and then there they were, a pair of psuedo-soundcamps back in the neighborhood blasting music to no one. Last year we were in the same area and around 2 or 3am it would be quiet...it was real nice. Someone in the burning man sub also mentioned that they felt like there is currently a glut of these silly pretend sound camps that don't actually do anything cool - I guess it is easy to set up a stage and speakers and say you are providing a service. Apparently that big pyramid sound camp on Esplanade that looked like a convention center ended up actually kinda sucking after spending a ton of money and time building a massive structure. ","i thought so too, and then there they were, a pair of psuedo-soundcamps back in the neighborhood blasting music to no one. last year we were in the same area and around 2 or 3am it would be quiet...it was real nice. someone in the burning man sub also mentioned that they felt like there is currently a glut of these silly pretend sound camps that don't actually do anything cool - i guess it is easy to set up a stage and speakers and say you are providing a service. apparently that big pyramid sound camp on esplanade that looked like a convention center ended up actually kinda sucking after spending a ton of money and time building a massive structure. ",122
dmpqwjt,1504839845.0,BurningMan,syn-aesthetic,"Definitely the best sound camp on the playa every year for quite some time.

I played a wave set there Thursday morning (possibly the first wave set at burning man?) with a little witch house, eurobass, and chilltrap mixed in (just to add to your genre list, hehe). In addition to their amazing sound and design, it seems like they were one of the only big soundcamps willing to experiment with newer genres.

https://soundcloud.com/syn-aesthetic/camp-q",2.0,,,"Definitely the best sound camp on the playa every year for quite some time. I played a wave set there Thursday morning (possibly the first wave set at burning man?) with a little witch house, eurobass, and chilltrap mixed in (just to add to your genre list, hehe). In addition to their amazing sound and design, it seems like they were one of the only big soundcamps willing to experiment with newer genres. ","definitely the best sound camp on the playa every year for quite some time. i played a wave set there thursday morning (possibly the first wave set at burning man?) with a little witch house, eurobass, and chilltrap mixed in (just to add to your genre list, hehe). in addition to their amazing sound and design, it seems like they were one of the only big soundcamps willing to experiment with newer genres. ",73
dmpe6gk,1504823609.0,BurningMan,rv_vino,"I second the notion that you need to find out what you need to be comfortable, function, and enjoy yourself in the harsh environment that is the playa. For example- I was telling my friend how he should go to BM at some point in his life, but because he is a cranky depressed a**hat if he can't get what he believes is enough sleep every night, he needs to plan for that. Because this year was hot as f***, he would need an RV and availability to run AC all night, away from any soundcamps. 

[keep reading if you are interested in how our preparations/set-up worked for us]
As this year was our first burn, I think myself and lilac_meddow did alright. I live and travel in my RV, and have means to live offgrid (adequate waste tanks, 2 2000w gennys, one of which kicked the dust [temporarily I hope] which meant no AC, but we were still able to run a fan inside and keep the house batteries charged). We did bring waaay too much water (not a bad thing), we drank about 18-20 gallons, had another 20+ gallons of drinking water in large containers, and obviously had the freshwater tank in the RV (50 gallons) full for things like shower, toilet, dishes. 

If you do bring an RV, keep in mind your fridge may not work very well (we used the freezer to keep things cool as the fridge ran 50-60 degrees, yes we had thermometers in each). Cold lemon water became my favorite drink of choice during the hot hours. We had mostly non-perishable foods...throw a can of soup or a packet of indian food out on the sunny playa to heat up. Lavender oil/water in a spraybottle and baby wipes kept us ""fresh"" all week.

One hack we had to make was making sure the RV didn't heat up in the morning hours so we could sleep and because once its hot, its difficult to cool down with the decreased airflow of the addition of filters on the windows and vents. I had watched a video from some other RV full-timers who have gone to Burning Man. Park north, so you can use your awning in the morning (east side) and put up a sunshade on the other/west side, diagonally and secured to the ground (we used lag screws). We weren't up early enough in the morning to put up the awning, and I was definitly not going to leave it up since its an expensive sail. We used two pop-up canopies, and attached some side-walls between the canopies and the roof of the RV, and secured it all with lag screws and ratchet straps. This set-up still didn't keep the RV from heating up to 95 each day, but it delayed it to allow for sleep. Next Burn i'm facing the RV south because the solar shades breath more than canopies.",1.0,,,"I second the notion that you need to find out what you need to be comfortable, function, and enjoy yourself in the harsh environment that is the playa. For example- I was telling my friend how he should go to BM at some point in his life, but because he is a cranky depressed a**hat if he can't get what he believes is enough sleep every night, he needs to plan for that. Because this year was hot as f***, he would need an RV and availability to run AC all night, away from any soundcamps.  keep reading if you are interested in how our preparations/set-up worked for us As this year was our first burn, I think myself and lilac_meddow did alright. I live and travel in my RV, and have means to live offgrid (adequate waste tanks, 2 2000w gennys, one of which kicked the dust temporarily I hope which meant no AC, but we were still able to run a fan inside and keep the house batteries charged). We did bring waaay too much water (not a bad thing), we drank about 18-20 gallons, had another 20 gallons of drinking water in large containers, and obviously had the freshwater tank in the RV (50 gallons) full for things like shower, toilet, dishes.  If you do bring an RV, keep in mind your fridge may not work very well (we used the freezer to keep things cool as the fridge ran 50-60 degrees, yes we had thermometers in each). Cold lemon water became my favorite drink of choice during the hot hours. We had mostly non-perishable foods...throw a can of soup or a packet of indian food out on the sunny playa to heat up. Lavender oil/water in a spraybottle and baby wipes kept us ""fresh"" all week. One hack we had to make was making sure the RV didn't heat up in the morning hours so we could sleep and because once its hot, its difficult to cool down with the decreased airflow of the addition of filters on the windows and vents. I had watched a video from some other RV full-timers who have gone to Burning Man. Park north, so you can use your awning in the morning (east side) and put up a sunshade on the other/west side, diagonally and secured to the ground (we used lag screws). We weren't up early enough in the morning to put up the awning, and I was definitly not going to leave it up since its an expensive sail. We used two pop-up canopies, and attached some side-walls between the canopies and the roof of the RV, and secured it all with lag screws and ratchet straps. This set-up still didn't keep the RV from heating up to 95 each day, but it delayed it to allow for sleep. Next Burn i'm facing the RV south because the solar shades breath more than canopies.","i second the notion that you need to find out what you need to be comfortable, function, and enjoy yourself in the harsh environment that is the playa. for example- i was telling my friend how he should go to bm at some point in his life, but because he is a cranky depressed a**hat if he can't get what he believes is enough sleep every night, he needs to plan for that. because this year was hot as f***, he would need an rv and availability to run ac all night, away from any soundcamps.  keep reading if you are interested in how our preparations/set-up worked for us as this year was our first burn, i think myself and lilac_meddow did alright. i live and travel in my rv, and have means to live offgrid (adequate waste tanks, 2 2000w gennys, one of which kicked the dust temporarily i hope which meant no ac, but we were still able to run a fan inside and keep the house batteries charged). we did bring waaay too much water (not a bad thing), we drank about 18-20 gallons, had another 20 gallons of drinking water in large containers, and obviously had the freshwater tank in the rv (50 gallons) full for things like shower, toilet, dishes.  if you do bring an rv, keep in mind your fridge may not work very well (we used the freezer to keep things cool as the fridge ran 50-60 degrees, yes we had thermometers in each). cold lemon water became my favorite drink of choice during the hot hours. we had mostly non-perishable foods...throw a can of soup or a packet of indian food out on the sunny playa to heat up. lavender oil/water in a spraybottle and baby wipes kept us ""fresh"" all week. one hack we had to make was making sure the rv didn't heat up in the morning hours so we could sleep and because once its hot, its difficult to cool down with the decreased airflow of the addition of filters on the windows and vents. i had watched a video from some other rv full-timers who have gone to burning man. park north, so you can use your awning in the morning (east side) and put up a sunshade on the other/west side, diagonally and secured to the ground (we used lag screws). we weren't up early enough in the morning to put up the awning, and i was definitly not going to leave it up since its an expensive sail. we used two pop-up canopies, and attached some side-walls between the canopies and the roof of the rv, and secured it all with lag screws and ratchet straps. this set-up still didn't keep the rv from heating up to 95 each day, but it delayed it to allow for sleep. next burn i'm facing the rv south because the solar shades breath more than canopies.",487
dmnee9l,1504723043.0,BurningMan,Chicagobearsman,"1) how big burning man physically is 

2) how diversity the camps were (from soundcamps to zipline/ gokarting to business workshops to orgydome etc). 

3) how easy it was to start talking to strangers at the bar. although admittedly, not all interactions were positive. As a person of color, i did get some prejudice vibes a few times unfortunately

",14.0,,,"1) how big burning man physically is  2) how diversity the camps were (from soundcamps to zipline/ gokarting to business workshops to orgydome etc).  3) how easy it was to start talking to strangers at the bar. although admittedly, not all interactions were positive. As a person of color, i did get some prejudice vibes a few times unfortunately ","1) how big burning man physically is  2) how diversity the camps were (from soundcamps to zipline/ gokarting to business workshops to orgydome etc).  3) how easy it was to start talking to strangers at the bar. although admittedly, not all interactions were positive. as a person of color, i did get some prejudice vibes a few times unfortunately ",59
dmmkzj6,1504674547.0,BurningMan,BrockVelocity,"Yup, Questionmark has had this high-quality sound for at least the last four or five years. I think most of their music would be classified as trap, or perhaps west coast bass. They're the shit, one of my favorite soundcamps.",15.0,,,"Yup, Questionmark has had this high-quality sound for at least the last four or five years. I think most of their music would be classified as trap, or perhaps west coast bass. They're the shit, one of my favorite soundcamps.","yup, questionmark has had this high-quality sound for at least the last four or five years. i think most of their music would be classified as trap, or perhaps west coast bass. they're the shit, one of my favorite soundcamps.",40
dhxhoak,1495547436.0,FestivalSluts,Austinbusker,"Definitely agree with you.

Wasn't gonna risk security and potential shitshows camping at a first year festival like this. Any wristband got you into the campground too, and you could stay and rage until 4am so nothing was lost. The soundcamps were incredible! MiddleLands was amazing, but the 'best part' is still probably fucking her in the hotel.",3.0,,,"Definitely agree with you. Wasn't gonna risk security and potential shitshows camping at a first year festival like this. Any wristband got you into the campground too, and you could stay and rage until 4am so nothing was lost. The soundcamps were incredible! MiddleLands was amazing, but the 'best part' is still probably fucking her in the hotel.","definitely agree with you. wasn't gonna risk security and potential shitshows camping at a first year festival like this. any wristband got you into the campground too, and you could stay and rage until 4am so nothing was lost. the soundcamps were incredible! middlelands was amazing, but the 'best part' is still probably fucking her in the hotel.",58
dhqdfmi,1495131521.0,MiddleLands,huseirdaddy,"So... Just so you all know, as amazing as the soundcamps were, Call of Booty especially, they're the reasons we didn't get a Bassnectar secret set. The first night CoB got two sound warnings that they ignored, the other large set up by the ""something"" collective got one as well and ignored. So, bassnectar was scheduled AND PAID to do a secret set night two, but because the soundcamps were so obviously limited the rest of the time he couldn't perform his normal sound and volume. And this is coming from higher managers of insomniac.",2.0,,,"So... Just so you all know, as amazing as the soundcamps were, Call of Booty especially, they're the reasons we didn't get a Bassnectar secret set. The first night CoB got two sound warnings that they ignored, the other large set up by the ""something"" collective got one as well and ignored. So, bassnectar was scheduled AND PAID to do a secret set night two, but because the soundcamps were so obviously limited the rest of the time he couldn't perform his normal sound and volume. And this is coming from higher managers of insomniac.","so... just so you all know, as amazing as the soundcamps were, call of booty especially, they're the reasons we didn't get a bassnectar secret set. the first night cob got two sound warnings that they ignored, the other large set up by the ""something"" collective got one as well and ignored. so, bassnectar was scheduled and paid to do a secret set night two, but because the soundcamps were so obviously limited the rest of the time he couldn't perform his normal sound and volume. and this is coming from higher managers of insomniac.",95
dgkplnf,1492804640.0,BurningMan,doctor-yes,"It takes more than slicing electrical lines, spilling the camp water supply, and gluing trailer doors shut to get douche-laden plug n' play soundcamps to go away. 

Steppin' my game up this year! :)",28.0,,,"It takes more than slicing electrical lines, spilling the camp water supply, and gluing trailer doors shut to get douche-laden plug n' play soundcamps to go away.  Steppin' my game up this year! )","it takes more than slicing electrical lines, spilling the camp water supply, and gluing trailer doors shut to get douche-laden plug n' play soundcamps to go away.  steppin' my game up this year! )",34
