id,created_utc,subreddit,author,body,score,ups,permalink,body_clean,body_clean_lower,comment_word_count
iyaraz5,1669768192.0,LostLandsMusicFest,Spiritual_Language82,"Update: I went to Lost Lands and did not regret my decision at all (only bummed to miss a Porter set but I’d just seen him at EZoo! LL was sooo insanely amazing, everything about it was so beautiful, I went with a rave fam 20+ deep and we had an awesome camp, plus everyone I met was so amazing! Only one person ever pushed me the entire fest, and even though it was sold out my friends and I all still had space to dance and do our thing (not a lot of space to hoop/flow arts in the crowd but that’s what the back is for anyways!!)! I’m definitely thinking of going next year, deciding between LL and EForest depending on my budget 🥰 my main concern about the constant bass was all good bc I found out that a) I like dub more than I thought and b) if I got tired of it there were always fun soundcamps to go to and sometimes artists like LevelUp etc mix fun pop into their sets that really split it up well. Also another thing is the vibes are so great there that I had no issues with party favors and intimidating visuals! I was tr!pping during Sudden Death/VOYD set and still wasn’t spooked (and I hate scary things) bc i knew it was all for fun and also knew what to expect for visuals bc I’ve seen a sudden death show before LL. I heard firefly is always a bunch of teens and people who don’t pick up their own trash so glad I didn’t go there but I’m sure it still would have been fun!",1.0,,/r/LostLandsMusicFest/comments/vcxyno/firefly_vs_lost_lands/iyaraz5/,"Update I went to Lost Lands and did not regret my decision at all (only bummed to miss a Porter set but I’d just seen him at EZoo! LL was sooo insanely amazing, everything about it was so beautiful, I went with a rave fam 20 deep and we had an awesome camp, plus everyone I met was so amazing! Only one person ever pushed me the entire fest, and even though it was sold out my friends and I all still had space to dance and do our thing (not a lot of space to hoop/flow arts in the crowd but that’s what the back is for anyways!!)! I’m definitely thinking of going next year, deciding between LL and EForest depending on my budget  my main concern about the constant bass was all good bc I found out that a) I like dub more than I thought and b) if I got tired of it there were always fun soundcamps to go to and sometimes artists like LevelUp etc mix fun pop into their sets that really split it up well. Also another thing is the vibes are so great there that I had no issues with party favors and intimidating visuals! I was tr!pping during Sudden Death/VOYD set and still wasn’t spooked (and I hate scary things) bc i knew it was all for fun and also knew what to expect for visuals bc I’ve seen a sudden death show before LL. I heard firefly is always a bunch of teens and people who don’t pick up their own trash so glad I didn’t go there but I’m sure it still would have been fun!","update i went to lost lands and did not regret my decision at all (only bummed to miss a porter set but i’d just seen him at ezoo! ll was sooo insanely amazing, everything about it was so beautiful, i went with a rave fam 20 deep and we had an awesome camp, plus everyone i met was so amazing! only one person ever pushed me the entire fest, and even though it was sold out my friends and i all still had space to dance and do our thing (not a lot of space to hoop/flow arts in the crowd but that’s what the back is for anyways!!)! i’m definitely thinking of going next year, deciding between ll and eforest depending on my budget  my main concern about the constant bass was all good bc i found out that a) i like dub more than i thought and b) if i got tired of it there were always fun soundcamps to go to and sometimes artists like levelup etc mix fun pop into their sets that really split it up well. also another thing is the vibes are so great there that i had no issues with party favors and intimidating visuals! i was tr!pping during sudden death/voyd set and still wasn’t spooked (and i hate scary things) bc i knew it was all for fun and also knew what to expect for visuals bc i’ve seen a sudden death show before ll. i heard firefly is always a bunch of teens and people who don’t pick up their own trash so glad i didn’t go there but i’m sure it still would have been fun!",277
iu1cq2o,1666903307.0,BurningMan,mang0lassi,"Some camp on 2 o’clock was having a Berghain / Tresor inspired night, but when I showed up it was having a hard time competing with the larger soundcamps nearby and sound was clipping a bunch :( I want this so bad tho

Edit: I was also having a terrible night so that may have influenced my experience too. Ty to that camp for making it happen",6.0,,/r/BurningMan/comments/yegda5/mayan_warrior_founder_if_it_were_up_to_me_id_get/iu1cq2o/,"Some camp on 2 o’clock was having a Berghain / Tresor inspired night, but when I showed up it was having a hard time competing with the larger soundcamps nearby and sound was clipping a bunch ( I want this so bad tho Edit I was also having a terrible night so that may have influenced my experience too. Ty to that camp for making it happen","some camp on 2 o’clock was having a berghain / tresor inspired night, but when i showed up it was having a hard time competing with the larger soundcamps nearby and sound was clipping a bunch ( i want this so bad tho edit i was also having a terrible night so that may have influenced my experience too. ty to that camp for making it happen",67
iqdkwc8,1664464939.0,LostLandsMusicFest,40dthbskt,"I had an amazing time and this may have been my favorite year. The weather couldn’t have been more perfect. The marketplace stage was an awesome idea and perfect way to unwind after the long drive and setting up camp. Moving VIP at wompy helped so much with making that stage space more easily traversed. Music diversity was on point and provided a nice change of pace from the usual headbanger stuff. Lots of cool and memorable surprises like the John Summit b2b Subtronics, Eptic b2b Svdden Death, and that last minute announced Funtcase dnb set. 

However, my only issue this year is that this event is very quickly outgrowing the venue. You could really notice as the day went on how oversold it was. Using the bathroom later in the day meant sacrificing most of a set just because of how long the lines were. The pathways were just a sea of people and it was awful watching medical crews responding to an emergency struggle to drive their carts around. If you didn’t get to popular soundcamps like infekt or he$h early you were pretty much out of luck because they filled up so much you could barely hear the music in the back of the crowd. Yet again I think there needs to be significant changes to the Legend Valley grounds and the festival layout to accommodate for the larger crowd being brought in. 

All in all though, it was the highlight of the year for me and I’m already looking forward to 2023.",4.0,,/r/LostLandsMusicFest/comments/xr9p1v/thoughts_and_experience/iqdkwc8/,"I had an amazing time and this may have been my favorite year. The weather couldn’t have been more perfect. The marketplace stage was an awesome idea and perfect way to unwind after the long drive and setting up camp. Moving VIP at wompy helped so much with making that stage space more easily traversed. Music diversity was on point and provided a nice change of pace from the usual headbanger stuff. Lots of cool and memorable surprises like the John Summit b2b Subtronics, Eptic b2b Svdden Death, and that last minute announced Funtcase dnb set.  However, my only issue this year is that this event is very quickly outgrowing the venue. You could really notice as the day went on how oversold it was. Using the bathroom later in the day meant sacrificing most of a set just because of how long the lines were. The pathways were just a sea of people and it was awful watching medical crews responding to an emergency struggle to drive their carts around. If you didn’t get to popular soundcamps like infekt or he$h early you were pretty much out of luck because they filled up so much you could barely hear the music in the back of the crowd. Yet again I think there needs to be significant changes to the Legend Valley grounds and the festival layout to accommodate for the larger crowd being brought in.  All in all though, it was the highlight of the year for me and I’m already looking forward to 2023.","i had an amazing time and this may have been my favorite year. the weather couldn’t have been more perfect. the marketplace stage was an awesome idea and perfect way to unwind after the long drive and setting up camp. moving vip at wompy helped so much with making that stage space more easily traversed. music diversity was on point and provided a nice change of pace from the usual headbanger stuff. lots of cool and memorable surprises like the john summit b2b subtronics, eptic b2b svdden death, and that last minute announced funtcase dnb set.  however, my only issue this year is that this event is very quickly outgrowing the venue. you could really notice as the day went on how oversold it was. using the bathroom later in the day meant sacrificing most of a set just because of how long the lines were. the pathways were just a sea of people and it was awful watching medical crews responding to an emergency struggle to drive their carts around. if you didn’t get to popular soundcamps like infekt or he$h early you were pretty much out of luck because they filled up so much you could barely hear the music in the back of the crowd. yet again i think there needs to be significant changes to the legend valley grounds and the festival layout to accommodate for the larger crowd being brought in.  all in all though, it was the highlight of the year for me and i’m already looking forward to 2023.",256
iq6nofa,1664330099.0,LostLandsMusicFest,datstick778,"maybe it’s explained on the website but i didnt bother to look, i was also super confused. so basically soundcamp just means the smaller stages (inside the festival, not at camp) that opens midnight - 4 am. the mainstage (prehistoric evolution) stopped playing music at midnight. i was confused because i thought soundcamps could only accessed by campers but it’s not!",2.0,,/r/LostLandsMusicFest/comments/xpqita/can_someone_explain_how_the_sets_after_12_am_work/iq6nofa/,"maybe it’s explained on the website but i didnt bother to look, i was also super confused. so basically soundcamp just means the smaller stages (inside the festival, not at camp) that opens midnight - 4 am. the mainstage (prehistoric evolution) stopped playing music at midnight. i was confused because i thought soundcamps could only accessed by campers but it’s not!","maybe it’s explained on the website but i didnt bother to look, i was also super confused. so basically soundcamp just means the smaller stages (inside the festival, not at camp) that opens midnight - 4 am. the mainstage (prehistoric evolution) stopped playing music at midnight. i was confused because i thought soundcamps could only accessed by campers but it’s not!",61
iq6crh7,1664324999.0,LostLandsMusicFest,TabascoTiger,"Yeah, I'll never do acid or a major classic psychedelic due to the mindfuck at a fest. I tripped on 2CB for two days and felt nothing but good vibes. It felt a little sketch at late night soundcamps at 3am in certain crowds but it didn't get to me. Anyways, I saw tons of people getting carted out unresponsive last year but remarkably nothing this year. Must have been different crowds I guess, I'm just sorry you had that sort of experience.",3.0,,/r/LostLandsMusicFest/comments/xpu5ev/lost_lands_was_a_good_time_but_for_me_there_were/iq6crh7/,"Yeah, I'll never do acid or a major classic psychedelic due to the mindfuck at a fest. I tripped on 2CB for two days and felt nothing but good vibes. It felt a little sketch at late night soundcamps at 3am in certain crowds but it didn't get to me. Anyways, I saw tons of people getting carted out unresponsive last year but remarkably nothing this year. Must have been different crowds I guess, I'm just sorry you had that sort of experience.","yeah, i'll never do acid or a major classic psychedelic due to the mindfuck at a fest. i tripped on 2cb for two days and felt nothing but good vibes. it felt a little sketch at late night soundcamps at 3am in certain crowds but it didn't get to me. anyways, i saw tons of people getting carted out unresponsive last year but remarkably nothing this year. must have been different crowds i guess, i'm just sorry you had that sort of experience.",83
iq633k6,1664320475.0,LostLandsMusicFest,Excelling-,I met you guys at wompy during soundcamps!! One of you was asking me for food recommendations in Chicago bc you had a stop there!,2.0,,/r/LostLandsMusicFest/comments/xpv3ov/much_love_from_the_nz_crew_3/iq633k6/,I met you guys at wompy during soundcamps!! One of you was asking me for food recommendations in Chicago bc you had a stop there!,i met you guys at wompy during soundcamps!! one of you was asking me for food recommendations in chicago bc you had a stop there!,25
iq5igqf,1664311694.0,LostLandsMusicFest,Bundo111,"Well asteroid and raptor valley aren't typically open during the day but are as soundcamps, and they don't use the prehistoric evolution stage for soundcamps but ya",5.0,,/r/LostLandsMusicFest/comments/xpqita/can_someone_explain_how_the_sets_after_12_am_work/iq5igqf/,"Well asteroid and raptor valley aren't typically open during the day but are as soundcamps, and they don't use the prehistoric evolution stage for soundcamps but ya","well asteroid and raptor valley aren't typically open during the day but are as soundcamps, and they don't use the prehistoric evolution stage for soundcamps but ya",27
iq4m64i,1664299288.0,LostLandsMusicFest,CharCharlesge,Ayyyy thanks!!! Probably my favorite stage of soundcamps that night,2.0,,/r/LostLandsMusicFest/comments/xouqbl/does_anyone_have_song_ids_from_hydraulix/iq4m64i/,Ayyyy thanks!!! Probably my favorite stage of soundcamps that night,ayyyy thanks!!! probably my favorite stage of soundcamps that night,10
iq0dvbq,1664220774.0,LostLandsMusicFest,PaidPunchingBag,"Oh 110%, I meant like a 12a-4a showcase at one of the soundcamps for Friday or Saturday night",2.0,,/r/LostLandsMusicFest/comments/xoq3us/starting_a_petition_for_gentlemens_club_wbommer/iq0dvbq/,"Oh 110%, I meant like a 12a-4a showcase at one of the soundcamps for Friday or Saturday night","oh 110%, i meant like a 12a-4a showcase at one of the soundcamps for friday or saturday night",18
iou2r8d,1663443796.0,LostLandsMusicFest,NiceGuyRonnis,"what should I expect for the soundcamps? I've been hearing a lot of people say that they are disrespectful to the artist bc of how quiet they are ( especially woompy after 12, or at least so i hear ). is this something you've noticed? I'm really looking forward to seeing Hol! and i guess im just a bit anxious they might make his set quiet.",2.0,,/r/LostLandsMusicFest/comments/xgoy8z/ama/iou2r8d/,"what should I expect for the soundcamps? I've been hearing a lot of people say that they are disrespectful to the artist bc of how quiet they are ( especially woompy after 12, or at least so i hear ). is this something you've noticed? I'm really looking forward to seeing Hol! and i guess im just a bit anxious they might make his set quiet.","what should i expect for the soundcamps? i've been hearing a lot of people say that they are disrespectful to the artist bc of how quiet they are ( especially woompy after 12, or at least so i hear ). is this something you've noticed? i'm really looking forward to seeing hol! and i guess im just a bit anxious they might make his set quiet.",66
ioat4bv,1663098678.0,LostLandsMusicFest,Jnectar16,"Pre party in 2019 went from 6pm-11pm and that so far has been the earliest start and longest one (last years was different due to weather) and soundcamps are inside the venue on the exact same stages they are listed on, the only difference is sound is turned down, so for your example you can simply just walk from the stage excision is playing on to the stage zingara is playing on, there is only a line if you exit the venue and come back",2.0,,/r/LostLandsMusicFest/comments/xdgmmm/what_time_does_the_pre_party_b2b2b_start_anyone/ioat4bv/,"Pre party in 2019 went from 6pm-11pm and that so far has been the earliest start and longest one (last years was different due to weather) and soundcamps are inside the venue on the exact same stages they are listed on, the only difference is sound is turned down, so for your example you can simply just walk from the stage excision is playing on to the stage zingara is playing on, there is only a line if you exit the venue and come back","pre party in 2019 went from 6pm-11pm and that so far has been the earliest start and longest one (last years was different due to weather) and soundcamps are inside the venue on the exact same stages they are listed on, the only difference is sound is turned down, so for your example you can simply just walk from the stage excision is playing on to the stage zingara is playing on, there is only a line if you exit the venue and come back",85
ioa722d,1663089471.0,ImagineMusicFestival,HumanitySurpassed,"No idew honestly. 

Judging though by the time slots being right after the main grounds end, ima guess a dj from the official lineup? 

Not one of the big acts but someone lower. I think I remember people saying toadface played at one of the soundcamps one year",1.0,,/r/ImagineMusicFestival/comments/xcfx83/any_guesses_on_the_blurred_names/ioa722d/,"No idew honestly.  Judging though by the time slots being right after the main grounds end, ima guess a dj from the official lineup?  Not one of the big acts but someone lower. I think I remember people saying toadface played at one of the soundcamps one year","no idew honestly.  judging though by the time slots being right after the main grounds end, ima guess a dj from the official lineup?  not one of the big acts but someone lower. i think i remember people saying toadface played at one of the soundcamps one year",48
io8b19p,1663054758.0,LostLandsMusicFest,Pesime,Yeah late night wompy was pretty bad but it was bearable by the last night. Ive been thinking that they just didn't really do a lot of night time soundcheck for any of the soundcamps because they were all different volumes each night like they were constantly trying to figure it out. Asteroid was always loud enough though because it's so small.,4.0,,/r/LostLandsMusicFest/comments/xcxq49/is_wompy_woods_after_midnight_gona_be_so_quiet/io8b19p/,Yeah late night wompy was pretty bad but it was bearable by the last night. Ive been thinking that they just didn't really do a lot of night time soundcheck for any of the soundcamps because they were all different volumes each night like they were constantly trying to figure it out. Asteroid was always loud enough though because it's so small.,yeah late night wompy was pretty bad but it was bearable by the last night. ive been thinking that they just didn't really do a lot of night time soundcheck for any of the soundcamps because they were all different volumes each night like they were constantly trying to figure it out. asteroid was always loud enough though because it's so small.,62
inykmn5,1662881135.0,LostLandsMusicFest,Bundo111,"I'd imagine habstrakt will get a better slot than soundcamps, he's fairly big",3.0,,/r/LostLandsMusicFest/comments/xb0mc3/the_asteroid_lineup/inykmn5/,"I'd imagine habstrakt will get a better slot than soundcamps, he's fairly big","i'd imagine habstrakt will get a better slot than soundcamps, he's fairly big",13
inx8rah,1662854458.0,LostLandsMusicFest,Pesime,Dr fresch is pretty big and was in the day last year I'm pretty sure so I don't think they'll put him on soundcamps. I'm also hoping meal prep gets a day set too because it destroyed foot traffic last year having it in the asteroid.,5.0,,/r/LostLandsMusicFest/comments/xb0mc3/the_asteroid_lineup/inx8rah/,Dr fresch is pretty big and was in the day last year I'm pretty sure so I don't think they'll put him on soundcamps. I'm also hoping meal prep gets a day set too because it destroyed foot traffic last year having it in the asteroid.,dr fresch is pretty big and was in the day last year i'm pretty sure so i don't think they'll put him on soundcamps. i'm also hoping meal prep gets a day set too because it destroyed foot traffic last year having it in the asteroid.,46
