,CompanyName,ReviewDate,ReviewContent,StarRating,ReviewType,Metadata
652d8acacaf29e604aef49d5,playlistbooker,2023-10-16 21:11:06,"They deliver what i paid for, but it takes long: I made 3 orders with playlistbooker so far, all of them was for the algo package.I had 2 for their bronze package (15-20k play advertised).My orders received 16k and 22k play, so i get what i paid for.My 3rd order was for their Silver package (25-30k play) which is still in progress, currently at 19k.It took them a little over 2 month to reach the 20k range, as my song was only getting around 250-450 daily.Basically I'm getting what i paid for, but they could do it a bit faster..",4,Trustpilot,"{'ExperienceDate': 'August 04, 2023', 'AuthorName': 'Kathleen Perrott', 'AuthorCountry': 'US', 'AuthorReviews': 1, 'ProfileLink': 'https://www.trustpilot.com/users/652d8ab7cb54a900119e79a5', 'ReviewLink': 'https://www.trustpilot.com/reviews/652d8acacaf29e604aef49d5'}"
652d44c2d66d3f36447a71af,playlistbooker,2023-10-16 16:12:18,"Payed for 20,000 streams: Payed for 20,000 streams, got 5,000. Support doesn't answer emails. At one point they promised to restart the campaign but there were no additional streams. No reputable company treats people like this.",1,Trustpilot,"{'ExperienceDate': 'October 16, 2023', 'AuthorName': 'Michael Macrides', 'AuthorCountry': 'US', 'AuthorReviews': 1, 'ProfileLink': 'https://www.trustpilot.com/users/652d44b8cb54a900119e4713', 'ReviewLink': 'https://www.trustpilot.com/reviews/652d44c2d66d3f36447a71af'}"
6512eee72531a5dd57c709a5,playlistbooker,2023-09-26 16:47:03,"Ordered the Spotify Algorithmic Package…: Ordered the Spotify Algorithmic Package starter the 17th of August. So far I've not gotten anything from them. Today is the 26th of September,Have written several e-mails and showed them screenshots from ""Spotify for artists"" where they can see that nothing is happening. They are just telling me it will pick up soon, this company is a scam, DON'T USE THEM, you will only loose money. It is sad cause I've ordered other packages with them in the past that seemed to be working. I would have liked to give them 0 stars here if it was possible.",1,Trustpilot,"{'ExperienceDate': 'August 17, 2023', 'AuthorName': 'Nils Malmport', 'AuthorCountry': 'BE', 'AuthorReviews': 10, 'ProfileLink': 'https://www.trustpilot.com/users/61e416bffc871a0012be9338', 'ReviewLink': 'https://www.trustpilot.com/reviews/6512eee72531a5dd57c709a5'}"
6509132803bb0ab807aaaeba,playlistbooker,2023-09-19 05:19:04,They use Bots that will overall hurt…: They use Bots that will overall hurt your Spotify profile. After using them for years – they're ignoring my emails and providing no support. I had 10k followers and then it dropped down 3k overnight as Spotify identified them as fake follows.,1,Trustpilot,"{'ExperienceDate': 'September 19, 2023', 'AuthorName': 'Jerry Dibbs', 'AuthorCountry': 'AU', 'AuthorReviews': 1, 'ProfileLink': 'https://www.trustpilot.com/users/6509131cb2758f001106228f', 'ReviewLink': 'https://www.trustpilot.com/reviews/6509132803bb0ab807aaaeba'}"
650872c76792edb089dab19c,playlistbooker,2023-09-18 17:54:47,"ALGORITHM PLAY SERVICE: Their algorithm plays service is fraudulent. They take your money and do nothing. I have repeatedly asked for a refund because of this, and they do not respond. DO NOT USE THESE SCAM ARTISTS!",1,Trustpilot,"{'ExperienceDate': 'September 18, 2023', 'AuthorName': 'Jesse', 'AuthorCountry': 'CA', 'AuthorReviews': 1, 'ProfileLink': 'https://www.trustpilot.com/users/650872b1fb5faa0012097972', 'ReviewLink': 'https://www.trustpilot.com/reviews/650872c76792edb089dab19c'}"
650220a7bfa0429a397d1d5c,playlistbooker,2023-09-13 22:50:47,Scammers.: This company or whatever it is is a waste of money run by unprofessionals who lack knowledge. The results are unsatisfactory and most emails are not returned. They just take your money and pretend they are doing the work. Full of scams. Do not waste your money.,1,Trustpilot,"{'ExperienceDate': 'September 12, 2023', 'AuthorName': 'Don’t Matter', 'AuthorCountry': 'US', 'AuthorReviews': 1, 'ProfileLink': 'https://www.trustpilot.com/users/6502206ce7d88400119963b2', 'ReviewLink': 'https://www.trustpilot.com/reviews/650220a7bfa0429a397d1d5c'}"
64f1ad270f64e70fdc4f81c6,playlistbooker,2023-09-01 11:21:43,Just scam: Just scam. Don‘t waste your money here.,1,Trustpilot,"{'ExperienceDate': 'September 01, 2023', 'AuthorName': 'Musician', 'AuthorCountry': 'CH', 'AuthorReviews': 1, 'ProfileLink': 'https://www.trustpilot.com/users/64f1ad14ba47230012e11562', 'ReviewLink': 'https://www.trustpilot.com/reviews/64f1ad270f64e70fdc4f81c6'}"
64e70ce55ae680d28965fe99,playlistbooker,2023-08-24 09:55:17,"I really did have a great experience…: I really did have a great experience with this promotion team. After my first campaign period, I hadn’t gotten on any playlist due to limited playlist curators in that in particular genre but was offered a second promotion campaign in a different genre or free because of how much they believed in my music.",5,Trustpilot,"{'ExperienceDate': 'August 18, 2023', 'AuthorName': 'Olesia Goncharyk', 'AuthorCountry': 'NL', 'AuthorReviews': 1, 'ProfileLink': 'https://www.trustpilot.com/users/64e70cdd953b290012bf206f', 'ReviewLink': 'https://www.trustpilot.com/reviews/64e70ce55ae680d28965fe99'}"
64e70c1e53932a6493492f0e,playlistbooker,2023-08-24 09:51:58,They provide great service!: My experience with Playlist Booker has been excellent. The first campaign I did with them landed one of my songs on over 20 playlists. I'm looking forward to working more with Playlist Booker in the future. They offer a great way for artists to get their music in front of playlist curators.,5,Trustpilot,"{'ExperienceDate': 'August 01, 2023', 'AuthorName': 'Antonis Toska', 'AuthorCountry': 'GR', 'AuthorReviews': 3, 'ProfileLink': 'https://www.trustpilot.com/users/644e47811d3bda00130d51fa', 'ReviewLink': 'https://www.trustpilot.com/reviews/64e70c1e53932a6493492f0e'}"
64b561b6966e3c9d0c91cfec,playlistbooker,2023-07-17 17:43:50,Lesson Learned!: I paid a great deal of hard earned money and got scammed. They did not honor their service. I got dropped repeatedly from playlists that I recently discovered had no following just likes. Then support never responded even when I backed up my claim with screenshots and screen recordings. My advice is to RUN and either spend your money on ads or a reputable service. This definitely isn’t it! They will block and remove you if you warn others in the comments on Instagram.,1,Trustpilot,"{'ExperienceDate': 'July 17, 2023', 'AuthorName': 'mizz Que', 'AuthorCountry': 'US', 'AuthorReviews': 1, 'ProfileLink': 'https://www.trustpilot.com/users/64b560716c3c990012437a2e', 'ReviewLink': 'https://www.trustpilot.com/reviews/64b561b6966e3c9d0c91cfec'}"
645a7fc6a1688fe1b4f2e190,playlistbooker,2023-05-09 19:15:50,"Awesome service: Awesome service! They delivered all the streams that were promised and I gained so many new Spotify followers. It's hard to find a place like this that doesn't use bots, but the playlist booker service really works",5,Trustpilot,"{'ExperienceDate': 'April 30, 2023', 'AuthorName': 'Chass Bryan', 'AuthorCountry': 'GB', 'AuthorReviews': 1, 'ProfileLink': 'https://www.trustpilot.com/users/645a7fbdd2cfce0011cac6e1', 'ReviewLink': 'https://www.trustpilot.com/reviews/645a7fc6a1688fe1b4f2e190'}"
644d08b8da533e8fae2224ec,playlistbooker,2023-04-29 14:08:24,"I was initially impressed with the…: I was initially impressed with the amount of streams and followers. However, Spotify eliminated 1000 of my followers saying they were not real and my streams went from thousands per week to a couple hundred. I wrote them several times and they ignored me. I chose the 70k to 100k streams for each of my 3 singles and recieved 70k all together. Bottom line, theres a a risk but you can get some good exposure and followers. I would advise to go with the package for the minimum amount of money and dont go all in because Spotify could pull the plug at any moment.",2,Trustpilot,"{'ExperienceDate': 'April 29, 2023', 'AuthorName': 'Brendan Downes', 'AuthorCountry': 'US', 'AuthorReviews': 2, 'ProfileLink': 'https://www.trustpilot.com/users/5c004a78fa21614b2e9ef080', 'ReviewLink': 'https://www.trustpilot.com/reviews/644d08b8da533e8fae2224ec'}"
